{"v":"hscf-1","kind":"hscf_option_set","object":"synthetic_contact","property":"example_region","ek":["l","v","d","o","h","x"],"o":[["Region 01","region_01","",1,false],["Region 02","region_02","",2,false],["Region 03","region_03","",3,false],["Region 04","region_04","",4,false],["Region 05","region_05","",5,false],["Region 06","region_06","",6,false],["Region 07","region_07","",7,false],["Region 08","region_08","",8,false],["Region 09","region_09","",9,false],["Region 10","region_10","",10,false],["Region 11","region_11","",11,false],["Region 12","region_12","",12,false],["Region 13","region_13","",13,false],["Region 14","region_14","",14,false],["Region 15","region_15","",15,false],["Region 16","region_16","",16,false],["Region 17","region_17","",17,false],["Region 18","region_18","",18,false],["Region 19","region_19","",19,false],["Region 20","region_20","",20,false],["Region 21","region_21","",21,false],["Region 22","region_22","",22,false],["Region 23","region_23","",23,false],["Region 24","region_24","",24,false],["Region 25","region_25","",25,false],["Region 26","region_26","",26,false]],"raw":{"sourceHash":"sha256:d627fe2210e5f58f67793c0b0df5285adb014ca7b6c46caaa293cf05cec731b3"}}
